{
	"$schema": "./catalog.schema.json",
	"catalog_version": "1.0.0",
	"baseline": "IT/EU",
	"updated": "2026-10-13",
	"documents": [
		{
			"id": "legal_notice",
			"title": {"en": "Legal notice", "it": "Note legali"},
			"type": "page",
			"group": "core",
			"description": "Business identity (Impressum, mentions légales, note legali).",
			"applies_when": {"always": true},
			"required_elements": [
				{"key": "identity", "label": "Legal name, legal form and trade name", "legal_ref": "D.Lgs. 70/2003, art. 7(1)(a); Codice civile, art. 2250", "placeholders": ["business.legal_name", "business.legal_form", "business.trade_name", "business.owner_name"]},
				{"key": "registered_office", "label": "Registered office (geographical address)", "legal_ref": "D.Lgs. 70/2003, art. 7(1)(b); D.Lgs. 206/2005, art. 49(1)(c)", "placeholders": ["business.address", "business.country"]},
				{"key": "contacts", "label": "Contact details for rapid, direct communication, including e-mail", "legal_ref": "D.Lgs. 70/2003, art. 7(1)(c); D.Lgs. 206/2005, art. 49(1)(c)", "placeholders": ["business.email", "business.pec", "business.phone"]},
				{"key": "register", "label": "Business register / REA registration number", "legal_ref": "D.Lgs. 70/2003, art. 7(1)(d); Codice civile, art. 2250", "placeholders": ["business.rea"]},
				{"key": "vat_number", "label": "VAT number and tax code", "legal_ref": "D.Lgs. 70/2003, art. 7(1)(g); D.P.R. 633/1972, art. 35", "placeholders": ["business.vat_id", "business.tax_code"]},
				{"key": "company_data", "label": "Share capital paid up, sole-shareholder or liquidation status (companies)", "legal_ref": "Codice civile, art. 2250", "placeholders": ["business.share_capital"]},
				{"key": "authorisations", "label": "Licences or authorisations and the supervisory authority, where the activity requires them", "legal_ref": "D.Lgs. 70/2003, art. 7(1)(e)"}
			],
			"placeholders_used": ["business.legal_name", "business.trade_name", "business.legal_form", "business.owner_name", "business.address", "business.country", "business.email", "business.pec", "business.phone", "business.rea", "business.vat_id", "business.tax_code", "business.share_capital"],
			"legal_refs": ["D.Lgs. 70/2003, art. 7", "Directive 2000/31/EC, art. 5", "Codice civile, art. 2250", "D.P.R. 633/1972, art. 35", "D.Lgs. 206/2005 (Codice del Consumo), art. 49(1)(b)-(c)"],
			"review_cadence_months": 12,
			"checklist_status": "complete",
			"lint": [
				{"id": "odr_link", "pattern": "ec\\.europa\\.eu/consumers/odr|webgate\\.ec\\.europa\\.eu/odr", "severity": "error", "message": "Link to the EU ODR platform, discontinued on 20 July 2025 (Reg. (EU) 2024/3228). Remove it."}
			]
		},
		{
			"id": "privacy_policy",
			"title": {"en": "Privacy policy", "it": "Informativa sulla privacy"},
			"type": "page",
			"group": "core",
			"description": "Information to data subjects under GDPR arts. 13-14.",
			"applies_when": {"always": true},
			"required_elements": [
				{"key": "controller_identity", "label": "Identity and contact details of the controller (and EU representative, if any)", "legal_ref": "Reg. (EU) 2016/679, art. 13(1)(a)", "placeholders": ["business.legal_name", "business.address", "business.email", "business.pec", "business.eu_representative"]},
				{"key": "dpo_contact", "label": "Contact details of the data protection officer, where appointed", "legal_ref": "Reg. (EU) 2016/679, art. 13(1)(b)", "placeholders": ["business.dpo_name", "business.dpo_email"]},
				{"key": "purposes_legal_bases", "label": "Purposes of each processing and their legal bases", "legal_ref": "Reg. (EU) 2016/679, arts. 6(1), 13(1)(c)"},
				{"key": "legitimate_interests", "label": "Legitimate interests pursued, where art. 6(1)(f) is relied on", "legal_ref": "Reg. (EU) 2016/679, art. 13(1)(d)"},
				{"key": "recipients", "label": "Recipients or categories of recipients (payment, shipping, hosting, marketing providers)", "legal_ref": "Reg. (EU) 2016/679, art. 13(1)(e)", "placeholders": ["store.payment_gateways"]},
				{"key": "third_country_transfers", "label": "Transfers outside the EEA and the safeguards relied on", "legal_ref": "Reg. (EU) 2016/679, arts. 13(1)(f), 44-49"},
				{"key": "retention", "label": "Retention periods or the criteria used to set them", "legal_ref": "Reg. (EU) 2016/679, art. 13(2)(a)"},
				{"key": "data_subject_rights", "label": "Rights of access, rectification, erasure, restriction, portability and objection", "legal_ref": "Reg. (EU) 2016/679, arts. 13(2)(b), 15-22"},
				{"key": "consent_withdrawal", "label": "Right to withdraw consent at any time", "legal_ref": "Reg. (EU) 2016/679, arts. 7(3), 13(2)(c)"},
				{"key": "complaint", "label": "Right to lodge a complaint with a supervisory authority (Garante per la protezione dei dati personali)", "legal_ref": "Reg. (EU) 2016/679, arts. 13(2)(d), 77"},
				{"key": "statutory_contractual", "label": "Whether providing data is a statutory or contractual requirement, and the consequences of not providing it", "legal_ref": "Reg. (EU) 2016/679, art. 13(2)(e)"},
				{"key": "automated_decisions", "label": "Automated decision-making, including profiling (e.g. fraud scoring)", "legal_ref": "Reg. (EU) 2016/679, arts. 13(2)(f), 22"},
				{"key": "sources", "label": "Sources of data not collected from the data subject", "legal_ref": "Reg. (EU) 2016/679, art. 14(2)(f)"},
				{"key": "cookies_reference", "label": "Reference to the cookie policy", "legal_ref": "D.Lgs. 196/2003, art. 122", "placeholders": ["links.cookie_policy"]}
			],
			"placeholders_used": ["business.legal_name", "business.address", "business.email", "business.pec", "business.eu_representative", "business.dpo_name", "business.dpo_email", "store.payment_gateways", "links.cookie_policy"],
			"legal_refs": ["Reg. (EU) 2016/679 (GDPR), arts. 12-14", "D.Lgs. 196/2003 (Codice privacy), as amended by D.Lgs. 101/2018"],
			"review_cadence_months": 12,
			"checklist_status": "complete"
		},
		{
			"id": "cookie_policy",
			"title": {"en": "Cookie policy", "it": "Cookie policy"},
			"type": "page",
			"group": "core",
			"description": "Cookies and other tracking tools. Embed the consent plugin's own cookie list through its shortcode.",
			"applies_when": {"always": true},
			"required_elements": [
				{"key": "controller", "label": "Controller identity and contact details", "legal_ref": "Reg. (EU) 2016/679, art. 13(1)(a)", "placeholders": ["business.legal_name", "business.email"]},
				{"key": "categories", "label": "Categories of cookies and trackers (technical, analytics, profiling) and their purposes", "legal_ref": "D.Lgs. 196/2003, art. 122; Garante privacy, guidelines of 10 June 2021"},
				{"key": "cookie_list", "label": "List of cookies and trackers: name, provider, purpose, duration (consent plugin list)", "legal_ref": "Garante privacy, guidelines of 10 June 2021; Reg. (EU) 2016/679, art. 13(2)(a)"},
				{"key": "third_parties", "label": "Third parties setting cookies and links to their information", "legal_ref": "Reg. (EU) 2016/679, art. 13(1)(e)"},
				{"key": "legal_basis", "label": "Legal basis: consent for non-technical cookies; technical cookies exempt", "legal_ref": "Directive 2002/58/EC, art. 5(3); D.Lgs. 196/2003, art. 122(1)"},
				{"key": "analytics_conditions", "label": "Analytics treated as technical cookies: conditions met, where relied on", "legal_ref": "Garante privacy, guidelines of 10 June 2021"},
				{"key": "consent_management", "label": "How to give, refuse and withdraw consent (banner, preferences, browser settings)", "legal_ref": "Garante privacy, guidelines of 10 June 2021; Reg. (EU) 2016/679, art. 7(3)"},
				{"key": "transfers", "label": "Transfers outside the EEA by cookie providers", "legal_ref": "Reg. (EU) 2016/679, arts. 13(1)(f), 44-49"},
				{"key": "rights", "label": "Data subject rights and complaint to the supervisory authority", "legal_ref": "Reg. (EU) 2016/679, arts. 15-22, 77"},
				{"key": "privacy_link", "label": "Link to the privacy policy", "legal_ref": "Reg. (EU) 2016/679, art. 12(1)", "placeholders": ["links.privacy_policy"]}
			],
			"placeholders_used": ["business.legal_name", "business.email", "links.privacy_policy"],
			"legal_refs": ["Directive 2002/58/EC (ePrivacy), art. 5(3)", "D.Lgs. 196/2003, art. 122", "Garante privacy, Guidelines on cookies and other tracking tools, 10 June 2021", "Reg. (EU) 2016/679, arts. 7, 13"],
			"review_cadence_months": 6,
			"checklist_status": "complete"
		},
		{
			"id": "terms_of_sale",
			"title": {"en": "Terms and conditions of sale", "it": "Termini e condizioni di vendita"},
			"type": "page",
			"group": "core",
			"description": "General terms of distance sale to consumers.",
			"applies_when": {"always": true},
			"required_elements": [
				{"key": "seller_identity", "label": "Seller identity, geographical address and contact details", "legal_ref": "D.Lgs. 206/2005, art. 49(1)(b)-(d)", "placeholders": ["business.legal_name", "business.address", "business.email", "business.phone", "business.vat_id", "links.legal_notice"]},
				{"key": "scope", "label": "Scope, acceptance, version and date of the terms; terms available for storage and reproduction", "legal_ref": "D.Lgs. 70/2003, art. 12(3)"},
				{"key": "main_characteristics", "label": "Main characteristics of the goods or services (product pages)", "legal_ref": "D.Lgs. 206/2005, art. 49(1)(a)"},
				{"key": "prices", "label": "Total price including taxes, delivery and any additional charges", "legal_ref": "D.Lgs. 206/2005, art. 49(1)(e); D.Lgs. 70/2003, art. 7(1)(h)", "placeholders": ["store.currency"]},
				{"key": "contract_steps", "label": "Technical steps to conclude the contract, correcting input errors, languages, filing of the contract", "legal_ref": "D.Lgs. 70/2003, art. 12(1); Directive 2000/31/EC, art. 10"},